{
  "deadline": "2026-08-27T00:00:00Z",
  "discovery_date": "2026-08-26",
  "operation_created": true,
  "operation_id": "01M0ZDXFB0E9WHK5FRXP95189A",
  "reason": "",
  "run_id": "daily-20260826T161934Z",
  "scheduled_at": "2026-08-26T16:19:40Z",
  "seekingalpha_schedule_version": 1,
  "status": "queued"
}
