{
  "deadline": "2026-08-11T00:00:00Z",
  "discovery_date": "2026-08-10",
  "operation_created": false,
  "operation_id": "01KZN8KF1REMD9J6TR8SJW8CX0",
  "reason": "daily_discovery_already_known",
  "run_id": "daily-20260810T114443Z",
  "scheduled_at": "2026-08-10T11:44:49Z",
  "seekingalpha_schedule_version": 1,
  "status": "duplicate"
}
